{"$schema":"schemas/wakeword-downsampling.schema.json","clipId":"wake-clear","note":"Same recording of “Go Gators”: as captured at 48 kHz, and downsampled to 16 kHz to match the Google Speech Commands pretraining domain.","original":{"sampleRate":48000,"nyquistHz":24000,"waveform":[0.0,0.0,0.0,0.0,0.0,0.0,0.0,-0.0,-0.0,-0.005,-0.005,0.007,-0.005,-0.005,0.004,0.003,0.002,-0.003,-0.004,-0.004,0.006,0.005,-0.008,0.006,0.009,0.007,-0.011,0.009,0.006,-0.007,-0.007,0.009,-0.011,0.007,0.01,-0.013,-0.009,0.009,0.005,-0.007,-0.008,0.008,-0.012,-0.008,0.01,-0.009,0.007,0.007,0.011,-0.01,-0.009,0.009,-0.008,-0.008,0.009,-0.01,-0.01,0.018,-0.017,-0.01,-0.006,0.009,-0.009,-0.007,-0.006,0.008,-0.007,-0.004,0.008,-0.007,0.007,0.005,0.006,-0.006,0.007,0.006,-0.006,0.005,0.01,-0.008,-0.006,0.007,0.006,-0.007,-0.007,0.008,-0.007,-0.005,0.006,-0.004,-0.005,0.014,-0.004,-0.006,0.006,0.006,-0.003,-0.005,0.007,-0.005,-0.005,0.005,0.004,-0.006,0.004,0.005,-0.004,-0.004,0.004,0.004,-0.005,0.005,0.005,0.061,0.391,0.141,0.074,-0.073,0.068,0.051,0.222,-0.309,0.416,-0.553,0.633,-0.813,-0.677,-0.664,-0.669,-0.854,-0.715,-0.711,0.614,-0.898,0.664,-0.93,0.744,-0.913,0.767,-0.908,-0.848,0.583,0.818,0.744,-0.848,-0.925,-0.676,-0.89,-0.586,0.694,0.933,-0.692,-0.713,-0.938,0.836,0.775,-0.85,0.741,-0.943,0.548,-0.77,0.739,0.939,0.513,0.584,0.569,-0.668,0.615,0.671,-0.675,0.68,0.921,-0.814,0.934,0.797,-0.885,-0.907,0.943,-0.819,-0.868,-0.943,0.527,-0.524,0.522,-0.787,-0.74,0.675,0.343,-0.482,-0.624,0.583,0.602,-0.75,-0.73,0.634,-0.603,0.779,0.73,0.699,0.653,0.616,-0.617,0.677,-0.708,-0.806,-0.566,-0.587,-0.418,0.382,-0.456,-0.417,-0.378,-0.382,-0.374,-0.442,-0.414,-0.415,0.373,-0.36,-0.365,-0.307,-0.277,-0.287,-0.259,0.243,0.22,0.228,0.223,-0.17,0.071,-0.102,0.136,0.138,0.094,0.074,-0.081,0.08,0.096,-0.064,0.061,-0.035,-0.035,0.037,0.104,0.054,0.057,-0.178,0.106,0.192,0.111,-0.149,0.162,-0.216,-0.267,-0.303,-0.328,-0.463,-0.575,-0.63,0.793,0.623,0.972,-0.908,-0.869,-0.993,-0.511,-0.633,-0.985,-1.0,-0.999,-0.845,0.59,-0.938,-0.997,0.99,0.734,0.545,-0.541,0.983,-0.7,0.596,0.798,0.787,-0.81,0.754,0.804,-0.665,-0.751,0.449,-0.548,-0.499,-0.443,-0.425,-0.502,-0.631,-0.525,-0.463,-0.461,-0.537,-0.528,-0.5,-0.517,-0.453,0.468,-0.573,-0.562,0.286,-0.259,-0.187,0.271,-0.319,-0.377,-0.401,0.379,-0.552,-0.601,0.661,-0.905,0.634,0.484,-0.773,0.711,-0.462,0.655,0.618,0.503,-0.729,0.532,0.472,-0.53,-0.412,-0.641,0.482,-0.441,0.376,-0.723,-0.395,-0.418,-0.616,0.483,0.562,-0.447,-0.401,0.353,-0.637,0.505,-0.41,-0.293,-0.464,-0.396,-0.645,-0.523,0.493,-0.466,-0.19,-0.379,0.368,-0.558,-0.346,-0.468,-0.349,-0.375,-0.322,-0.316,-0.207,-0.437,-0.293,-0.387,0.288,-0.392,-0.348,0.376,-0.336,-0.396,0.335,0.312,0.316,-0.355,0.332,-0.266,-0.254,-0.241,-0.247,0.24,0.22,-0.291,0.244,-0.305,0.304,-0.22,0.308,-0.209,0.281,0.2,0.303,-0.236,-0.28,-0.213,-0.287,-0.196,-0.276,-0.125,-0.267,0.168,-0.236,0.222,-0.153,0.226,-0.138,-0.189,0.127,0.186,-0.105,-0.154,0.171,-0.131,0.137,0.143,0.165,0.098,-0.142,0.177,-0.137,0.15,-0.098,0.137,-0.071,0.128,0.128,-0.105,0.156,-0.087,0.151,-0.118,0.092,0.125,-0.088,0.12,0.093,0.118,-0.09,-0.131,0.132,-0.09,0.133,-0.105,-0.108,-0.09,-0.132,0.09,-0.096,-0.088,-0.072,-0.071,0.078,0.087,-0.092,-0.08,-0.067,0.072,-0.096,0.082,0.09,0.068,-0.082,0.07,-0.07,-0.068,-0.058,0.07,0.054,-0.05,-0.036,0.052,-0.04,0.048,-0.033,-0.046,-0.035,0.043,-0.037,-0.026,0.027,0.02,-0.026,0.021,0.02,-0.024,0.016,0.016,0.013,0.015,0.014,-0.013,-0.014,0.011,-0.013,-0.008,0.008,0.008,-0.009,0.009,0.009,-0.006,-0.012,0.007,0.005,-0.006,-0.005,0.004,-0.005,-0.007,0.005,0.005,-0.006,0.005,0.006,-0.006,0.004,0.004,-0.005,-0.005,0.004,0.004,-0.004,0.003,0.003,-0.004,-0.003,0.003,0.002,-0.003,0.002,0.004,-0.004,0.003,0.005,-0.005,-0.004,0.007,-0.004,0.005,-0.006,0.006,-0.005,0.004,0.004,-0.005,-0.005,0.004,-0.004,-0.005,0.004,0.005,-0.004,-0.004,0.004,-0.005,-0.005,0.005,-0.005,-0.005,0.004,0.005,-0.005,-0.006,0.004,-0.004,-0.004,0.004,-0.003,-0.005,-0.005,0.005,-0.004,-0.004,0.004,0.003,-0.003,0.003,0.004,-0.003,0.003,0.005,-0.003,-0.004,0.004,0.004,-0.004,0.003,0.004,-0.004,-0.003,0.004,-0.004,-0.004,0.004,0.003,-0.004,-0.004],"spectrum":[0.548,0.852,0.888,0.907,0.936,1.0,0.939,0.87,0.766,0.758,0.746,0.791,0.806,0.806,0.766,0.758,0.759,0.783,0.796,0.75,0.744,0.769,0.766,0.72,0.687,0.698,0.722,0.725,0.673,0.645,0.612,0.645,0.689,0.699,0.689,0.656,0.68,0.696,0.676,0.663,0.678,0.665,0.642,0.604,0.607,0.603,0.606,0.587,0.566,0.589,0.607,0.603,0.573,0.543,0.509,0.489,0.472,0.455,0.45,0.446,0.407,0.413,0.442,0.458,0.472,0.494,0.501,0.492,0.494,0.494,0.505,0.504,0.51,0.516,0.511,0.474,0.483,0.504,0.498,0.491,0.519,0.496,0.486,0.513,0.541,0.544,0.539,0.527,0.529,0.538,0.529,0.506,0.485,0.485,0.479,0.467,0.458,0.437,0.433,0.439,0.425,0.395,0.364,0.371,0.365,0.375,0.374,0.37,0.343,0.321,0.312,0.341,0.349,0.364,0.376,0.375,0.397,0.383,0.394,0.403,0.417,0.407,0.399,0.403,0.416,0.41,0.403,0.377,0.383,0.382,0.382,0.375,0.381,0.383,0.383,0.39,0.393,0.389,0.387,0.393,0.416,0.41,0.396,0.409,0.411,0.418,0.395,0.397,0.398,0.415,0.414,0.399,0.403,0.408,0.408,0.419,0.415,0.41,0.411,0.401,0.391,0.393,0.39,0.378,0.369,0.37,0.372,0.374,0.368,0.382,0.381,0.374,0.374,0.381,0.371,0.37,0.382,0.377,0.39,0.387,0.373,0.357,0.352,0.352,0.338,0.33,0.325,0.313,0.305,0.299,0.306,0.291,0.286,0.291,0.302,0.298,0.297,0.296,0.288,0.295,0.315,0.316,0.313,0.305,0.295,0.295,0.292,0.303,0.298,0.301,0.305,0.316,0.309,0.317,0.306,0.265,0.155,0.02,0.0,0.0,0.0,0.0,0.0,0.0,0.0,0.0,0.0,0.0,0.0,0.0,0.0,0.0,0.0,0.0,0.0,0.0,0.0,0.0,0.0,0.0,0.0,0.0,0.0,0.0,0.0,0.0,0.0,0.0,0.0,0.0,0.0,0.0,0.0,0.0,0.0,0.0],"spectrumDbRange":[-56.5,23.4]},"downsampled":{"sampleRate":16000,"nyquistHz":8000,"waveform":[0.0,0.0,0.0,0.0,0.0,0.0,-0.0,-0.0,-0.0,-0.005,-0.005,0.007,-0.005,-0.005,0.003,0.003,0.002,-0.002,-0.004,-0.004,0.006,0.005,-0.008,0.006,0.008,0.007,-0.011,0.009,0.005,-0.007,-0.006,0.009,-0.011,0.006,0.01,-0.012,-0.008,0.008,0.005,-0.007,-0.007,0.008,-0.012,-0.008,0.009,-0.009,-0.007,0.006,0.011,-0.009,-0.01,0.009,-0.007,-0.007,0.008,-0.007,-0.01,0.018,-0.017,-0.009,0.006,0.009,-0.009,-0.006,-0.006,0.007,-0.006,-0.003,0.007,-0.006,0.007,0.005,0.006,-0.005,0.007,0.005,-0.006,0.005,0.009,-0.007,-0.006,0.006,0.006,-0.007,-0.007,0.008,-0.006,-0.005,0.006,-0.004,-0.005,0.01,-0.004,-0.005,0.006,0.006,-0.003,-0.005,0.006,-0.004,-0.004,0.005,0.004,-0.005,0.004,0.005,-0.004,-0.004,0.004,0.004,-0.004,0.005,0.005,0.036,0.204,-0.124,0.063,0.056,0.061,0.046,0.22,-0.303,0.408,-0.551,0.607,-0.813,-0.708,-0.669,-0.64,-0.864,-0.67,-0.717,0.595,-0.901,0.664,-0.923,0.746,-0.905,0.777,-0.913,-0.842,0.581,0.811,0.718,-0.824,-0.932,-0.668,-0.891,-0.585,0.689,0.928,-0.682,-0.713,-0.943,0.83,0.773,-0.848,0.736,-0.942,0.551,-0.762,0.625,0.936,0.505,0.573,0.568,-0.666,0.619,0.669,-0.673,-0.682,0.913,-0.812,0.929,0.793,-0.876,-0.903,0.938,-0.822,-0.859,0.944,0.521,-0.519,-0.518,-0.774,-0.738,0.67,0.33,-0.48,-0.619,-0.583,0.601,-0.751,0.726,0.638,-0.601,0.776,0.732,0.687,0.653,0.621,-0.614,0.677,-0.713,-0.798,-0.523,-0.583,-0.421,0.381,-0.452,-0.408,-0.371,-0.383,-0.37,-0.446,-0.413,-0.415,0.368,-0.359,-0.365,-0.302,-0.276,-0.287,-0.259,0.236,0.215,0.226,0.222,-0.169,0.071,-0.101,0.136,0.138,0.093,0.073,-0.081,0.081,0.097,-0.064,0.061,-0.035,-0.035,0.036,-0.07,0.043,0.051,-0.137,0.088,0.195,0.092,0.13,0.149,-0.201,-0.249,-0.282,-0.317,-0.463,-0.578,-0.623,0.782,0.625,0.899,-0.899,-0.878,-0.969,-0.464,-0.575,-0.999,-1.0,-0.995,-0.837,0.581,-0.93,-0.965,0.952,0.728,0.549,-0.53,-0.963,-0.631,0.586,0.78,0.777,-0.809,0.746,0.787,-0.665,-0.747,0.44,-0.532,-0.492,-0.431,-0.404,-0.502,-0.629,-0.51,-0.451,-0.46,-0.533,-0.517,-0.502,-0.518,-0.452,-0.45,-0.573,-0.552,0.283,-0.257,-0.18,0.268,-0.318,-0.378,-0.408,-0.371,-0.555,-0.601,0.64,-0.905,0.636,0.488,-0.78,0.712,-0.447,0.651,0.607,0.509,-0.728,0.506,0.471,-0.54,-0.413,-0.636,0.476,-0.44,0.375,-0.719,-0.391,-0.419,-0.618,0.481,0.558,-0.427,-0.403,0.347,-0.64,0.493,-0.41,-0.293,-0.461,-0.397,-0.644,-0.524,0.488,-0.462,-0.188,-0.378,0.367,-0.557,-0.33,-0.468,-0.347,-0.368,-0.316,-0.312,-0.204,-0.437,-0.295,-0.387,0.279,-0.391,-0.347,0.377,-0.338,-0.396,0.327,0.31,0.323,-0.354,0.333,-0.257,-0.253,-0.239,-0.246,0.236,0.211,-0.289,0.243,-0.305,0.301,-0.218,0.307,-0.166,0.28,0.193,0.299,-0.237,-0.277,-0.212,-0.287,-0.195,-0.275,-0.128,-0.268,0.164,-0.236,0.219,-0.153,0.225,-0.138,-0.186,0.127,0.185,-0.104,-0.15,0.17,-0.129,0.137,0.144,0.165,0.098,-0.142,0.176,-0.137,0.147,-0.098,0.13,-0.071,0.118,0.121,-0.096,0.141,-0.083,0.129,-0.107,0.075,0.099,-0.054,0.092,-0.067,0.083,-0.076,0.073,0.101,-0.072,0.087,0.066,-0.068,0.056,-0.079,0.045,-0.065,-0.065,0.044,0.042,0.078,-0.067,-0.058,0.044,-0.065,0.041,-0.08,0.06,0.054,-0.051,-0.067,0.057,-0.062,-0.039,-0.054,0.06,-0.04,-0.048,-0.031,0.051,-0.037,0.041,-0.031,-0.03,0.034,0.041,-0.033,-0.027,0.024,0.016,-0.024,0.02,0.02,-0.022,0.015,0.014,0.012,0.013,0.013,-0.011,-0.015,0.008,-0.013,-0.007,0.008,0.006,-0.007,0.008,0.008,-0.006,-0.011,0.007,0.004,-0.006,-0.004,0.004,-0.004,-0.006,0.005,0.005,-0.006,0.005,0.005,-0.006,0.004,0.004,-0.005,-0.004,0.004,0.003,-0.004,0.003,0.003,-0.004,-0.003,0.002,0.002,-0.002,0.001,0.003,-0.004,0.003,0.005,-0.004,-0.004,0.006,-0.004,0.004,-0.005,0.006,-0.004,0.004,0.003,-0.005,-0.004,0.004,-0.003,-0.005,0.003,0.003,-0.003,-0.004,0.004,-0.004,-0.003,0.004,-0.004,-0.004,0.003,0.004,-0.004,-0.005,0.004,-0.003,-0.003,0.003,-0.002,-0.004,-0.004,0.004,-0.003,-0.004,0.004,0.003,-0.003,0.002,0.004,-0.003,0.003,0.004,-0.004,-0.004,0.004,0.003,-0.003,0.003,0.004,-0.003,-0.003,0.003,-0.003,-0.003,0.003,0.002,-0.004,-0.004],"spectrum":[0.402,0.507,0.668,0.832,0.832,0.845,0.824,0.878,0.849,0.873,0.903,0.888,0.865,0.931,1.0,0.983,0.959,0.947,0.898,0.862,0.887,0.818,0.799,0.767,0.742,0.736,0.72,0.745,0.735,0.711,0.732,0.73,0.783,0.762,0.767,0.772,0.793,0.803,0.81,0.785,0.782,0.766,0.75,0.735,0.745,0.759,0.738,0.743,0.76,0.739,0.744,0.774,0.782,0.766,0.777,0.791,0.745,0.709,0.728,0.746,0.725,0.719,0.742,0.755,0.767,0.765,0.76,0.739,0.731,0.711,0.674,0.665,0.678,0